<?xml version="1.0" encoding="UTF-8" standalone="yes"?>
<xs:schema xmlns:xs="http://www.w3.org/2001/XMLSchema" xmlns:jxb="http://java.sun.com/xml/ns/jaxb" jxb:version="2.1">
	<xs:include schemaLocation="../import.xsd"/>
	<xs:element name="zones">
		<xs:complexType>
			<xs:sequence>
				<xs:element ref="import" minOccurs="0" maxOccurs="unbounded"/>
				<xs:element name="zone" type="Zone" minOccurs="0" maxOccurs="unbounded"/>
			</xs:sequence>
		</xs:complexType>
	</xs:element>
	<xs:complexType name="Zone">
		<xs:choice>
			<xs:element name="cylinder" type="Cylinder" minOccurs="0" maxOccurs="1"/>
			<xs:element name="points" type="Points" minOccurs="0" maxOccurs="1"/>
			<xs:element name="sphere" type="Sphere" minOccurs="0" maxOccurs="1"/>
			<xs:element name="semisphere" type="Semisphere" minOccurs="0" maxOccurs="1"/>
		</xs:choice>
		<xs:attribute name="priority" type="xs:int"/>
		<xs:attribute name="siege_id" type="SiegeList"/>
		<xs:attribute name="town_id" type="xs:int" default="0"/>
		<xs:attribute name="zone_type" type="ZoneClassName"/>
		<xs:attribute name="area_type" type="AreaType"/>
		<xs:attribute name="name" type="ZoneName" use="required"/>
		<xs:attribute name="mapid" type="xs:int" use="required"/>
		<xs:attribute name="flags" type="xs:int" default="-1"/>
	</xs:complexType>
	<xs:complexType name="Points">
		<xs:sequence>
			<xs:element name="point" type="Point2D" minOccurs="1" maxOccurs="unbounded"/>
		</xs:sequence>
		<xs:attribute name="top" type="xs:float"/>
		<xs:attribute name="bottom" type="xs:float"/>
	</xs:complexType>
	<xs:complexType name="Cylinder">
		<xs:attribute name="top" type="xs:float"/>
		<xs:attribute name="bottom" type="xs:float"/>
		<xs:attribute name="x" type="xs:float"/>
		<xs:attribute name="y" type="xs:float"/>
		<xs:attribute name="r" type="xs:float"/>
	</xs:complexType>
	<xs:complexType name="Sphere">
		<xs:attribute name="x" type="xs:float"/>
		<xs:attribute name="y" type="xs:float"/>
		<xs:attribute name="z" type="xs:float"/>
		<xs:attribute name="r" type="xs:float"/>
	</xs:complexType>
	<xs:complexType name="Semisphere">
		<xs:complexContent>
			<xs:extension base="Sphere"/>
		</xs:complexContent>
	</xs:complexType>
	<xs:complexType name="Point2D">
		<xs:attribute name="x" type="xs:float"/>
		<xs:attribute name="y" type="xs:float"/>
	</xs:complexType>
	<xs:simpleType name="SiegeList">
		<xs:list itemType="xs:int"/>
	</xs:simpleType>
	<xs:simpleType name="ZoneClassName">
		<xs:restriction base="xs:string">
			<xs:enumeration value="SUB"/>
			<xs:enumeration value="FLY"/>
			<xs:enumeration value="RIDE"/>
			<xs:enumeration value="ARTIFACT"/>
			<xs:enumeration value="FORT"/>
			<xs:enumeration value="LIMIT"/>
			<xs:enumeration value="ITEM_USE"/>
			<xs:enumeration value="PVP"/>
			<xs:enumeration value="DUEL"/>
			<xs:enumeration value="HOUSE"/>
			<xs:enumeration value="WEATHER"/>
		</xs:restriction>
	</xs:simpleType>
	<xs:simpleType name="AreaType">
		<xs:restriction base="xs:string">
			<xs:enumeration value="POLYGON"/>
			<xs:enumeration value="CYLINDER"/>
			<xs:enumeration value="SPHERE"/>
			<xs:enumeration value="SEMISPHERE"/>
		</xs:restriction>
	</xs:simpleType>
	<xs:simpleType name="ZoneName">
		<xs:restriction base="xs:ID"/>
	</xs:simpleType>
</xs:schema>